{
  "schema_version": 1,
  "id": "wf-langfuse-langfuse-e85578e0",
  "display_name": "langfuse/langfuse Workflow",
  "source_type": "local",
  "source": "plugins/repository-workflows/individual/wf-langfuse-langfuse-e85578e0",
  "license_status": "MIT",
  "execution_class": "LOCAL_MUTATING",
  "status": "PACKAGED",
  "controller_plugin": "wf-langfuse-langfuse-e85578e0",
  "skill_paths": [
    "plugins/repository-workflows/individual/wf-langfuse-langfuse-e85578e0/skills/wf-langfuse-langfuse-e85578e0/SKILL.md"
  ],
  "mcp_servers": [],
  "runtime_probe": null
}