{
  "schema_version": 1,
  "id": "wf-librechat-ai-librechat-438ddea7",
  "display_name": "LibreChat-AI/LibreChat Workflow",
  "source_type": "local",
  "source": "plugins/repository-workflows/individual/wf-librechat-ai-librechat-438ddea7",
  "license_status": "MIT",
  "execution_class": "LOCAL_MUTATING",
  "status": "PACKAGED",
  "controller_plugin": "wf-librechat-ai-librechat-438ddea7",
  "skill_paths": [
    "plugins/repository-workflows/individual/wf-librechat-ai-librechat-438ddea7/skills/wf-librechat-ai-librechat-438ddea7/SKILL.md"
  ],
  "mcp_servers": [],
  "runtime_probe": null
}