{
  "schema_version": 1,
  "id": "wf-whitechronos-whitechronos-rea-lab-13b1eca9",
  "display_name": "WhiteChronos/whitechronos-rea-lab Workflow",
  "source_type": "local",
  "source": "plugins/repository-workflows/individual/wf-whitechronos-whitechronos-rea-lab-13b1eca9",
  "license_status": "MIT",
  "execution_class": "LOCAL_MUTATING",
  "status": "PACKAGED",
  "controller_plugin": "wf-whitechronos-whitechronos-rea-lab-13b1eca9",
  "skill_paths": [
    "plugins/repository-workflows/individual/wf-whitechronos-whitechronos-rea-lab-13b1eca9/skills/wf-whitechronos-whitechronos-rea-lab-13b1eca9/SKILL.md"
  ],
  "mcp_servers": [],
  "runtime_probe": null
}