{
  "schema_version": 1,
  "id": "defapi-jev",
  "display_name": "DefAPI Jev-1.13 Decision Adapter",
  "source_type": "local",
  "source": "plugins/jev-decisions",
  "license_status": "FIRST_PARTY_ADAPTER",
  "execution_class": "CREDENTIALLED",
  "status": "ACTIVATION_GATED",
  "controller_plugin": null,
  "skill_paths": [],
  "mcp_servers": [],
  "runtime_probe": null
}
