{
  "schema_version": 1,
  "id": "repository-workflows",
  "display_name": "Workflows dos Repositórios + REA",
  "source_type": "local",
  "source": "plugins/repository-workflows",
  "license_status": "MIT",
  "execution_class": "LOCAL_MUTATING",
  "status": "PACKAGED",
  "controller_plugin": "repository-workflows",
  "skill_paths": [
    "plugins/repository-workflows/skills/wf-1337hero-faster-chat-11cb6c69/SKILL.md",
    "plugins/repository-workflows/skills/wf-aeroxy-chrome-devtools-cli-ec64bb78/SKILL.md",
    "plugins/repository-workflows/skills/wf-affaan-m-ecc-0658d7fa/SKILL.md",
    "plugins/repository-workflows/skills/wf-arize-ai-phoenix-1ca6c04a/SKILL.md",
    "plugins/repository-workflows/skills/wf-chromedevtools-chrome-devtools-mcp-c68b4f26/SKILL.md",
    "plugins/repository-workflows/skills/wf-comet-ml-opik-mcp-786fea2f/SKILL.md",
    "plugins/repository-workflows/skills/wf-dataelement-bisheng-e21a4138/SKILL.md",
    "plugins/repository-workflows/skills/wf-future-agi-future-agi-dc3bdaee/SKILL.md",
    "plugins/repository-workflows/skills/wf-gbasin-dejank-5a6ba81e/SKILL.md",
    "plugins/repository-workflows/skills/wf-github-spec-kit-ea503c1a/SKILL.md",
    "plugins/repository-workflows/skills/wf-google-perfetto-72e3738b/SKILL.md",
    "plugins/repository-workflows/skills/wf-googlechrome-lighthouse-d1708a87/SKILL.md",
    "plugins/repository-workflows/skills/wf-jakeschincariol-arena-skill-c734ca29/SKILL.md",
    "plugins/repository-workflows/skills/wf-jakeschincariol-replica-skill-a44b40b4/SKILL.md",
    "plugins/repository-workflows/skills/wf-jamesmoore24-treegpt-6a43b665/SKILL.md",
    "plugins/repository-workflows/skills/wf-katanemo-plano-5d0e2850/SKILL.md",
    "plugins/repository-workflows/skills/wf-kepano-obsidian-skills-bdf89258/SKILL.md",
    "plugins/repository-workflows/skills/wf-langfuse-langfuse-e85578e0/SKILL.md",
    "plugins/repository-workflows/skills/wf-latitude-dev-latitude-llm-02e58234/SKILL.md",
    "plugins/repository-workflows/skills/wf-librechat-ai-librechat-438ddea7/SKILL.md",
    "plugins/repository-workflows/skills/wf-lobehub-lobehub-273e910e/SKILL.md",
    "plugins/repository-workflows/skills/wf-lognebudo-llmxray-26c34ef4/SKILL.md",
    "plugins/repository-workflows/skills/wf-mastra-ai-mastra-db814e7b/SKILL.md",
    "plugins/repository-workflows/skills/wf-microsoft-playwright-afbb5a8a/SKILL.md",
    "plugins/repository-workflows/skills/wf-mlflow-mlflow-93fff73e/SKILL.md",
    "plugins/repository-workflows/skills/wf-monoscope-tech-monoscope-66266baf/SKILL.md",
    "plugins/repository-workflows/skills/wf-obra-superpowers-4251a228/SKILL.md",
    "plugins/repository-workflows/skills/wf-openai-skills-f46db908/SKILL.md",
    "plugins/repository-workflows/skills/wf-openobserve-openobserve-edacb9cb/SKILL.md",
    "plugins/repository-workflows/skills/wf-puppeteer-puppeteer-7201fb0e/SKILL.md",
    "plugins/repository-workflows/skills/wf-pydantic-logfire-0b169f2d/SKILL.md",
    "plugins/repository-workflows/skills/wf-shimo4228-jev-skill-router-d055091d/SKILL.md",
    "plugins/repository-workflows/skills/wf-theopenco-llmgateway-74060a45/SKILL.md",
    "plugins/repository-workflows/skills/wf-tma1-ai-tma1-0b591684/SKILL.md",
    "plugins/repository-workflows/skills/wf-vectorize-io-hindsight-57687486/SKILL.md",
    "plugins/repository-workflows/skills/wf-vercel-labs-agent-skills-7327b382/SKILL.md",
    "plugins/repository-workflows/skills/wf-vercel-labs-skills-ac98481e/SKILL.md",
    "plugins/repository-workflows/skills/wf-vercel-next-js-079c0319/SKILL.md",
    "plugins/repository-workflows/skills/wf-vllm-project-semantic-router-5b33926f/SKILL.md",
    "plugins/repository-workflows/skills/wf-vllm-project-speculators-14d6fbcd/SKILL.md",
    "plugins/repository-workflows/skills/wf-whitechronos-chatgpt-e5a7df31/SKILL.md",
    "plugins/repository-workflows/skills/wf-whitechronos-whitechronos-rea-lab-13b1eca9/SKILL.md",
    "plugins/repository-workflows/skills/wf-wxk-ai-jev-opus-3395fe54/SKILL.md",
    "plugins/repository-workflows/skills/repository-systems-workflow/SKILL.md"
  ],
  "mcp_servers": [],
  "runtime_probe": null
}