{
  "schema_version": 1,
  "id": "wf-vercel-labs-agent-skills-7327b382",
  "display_name": "vercel-labs/agent-skills Workflow",
  "source_type": "local",
  "source": "plugins/repository-workflows/individual/wf-vercel-labs-agent-skills-7327b382",
  "license_status": "MIT",
  "execution_class": "LOCAL_MUTATING",
  "status": "PACKAGED",
  "controller_plugin": "wf-vercel-labs-agent-skills-7327b382",
  "skill_paths": [
    "plugins/repository-workflows/individual/wf-vercel-labs-agent-skills-7327b382/skills/wf-vercel-labs-agent-skills-7327b382/SKILL.md"
  ],
  "mcp_servers": [],
  "runtime_probe": null
}