{
  "schema_version": 1,
  "id": "ecc-specialists",
  "display_name": "ECC specialist workflows",
  "source_type": "upstream_git",
  "source": "https://github.com/affaan-m/ECC.git",
  "license_status": "MIT",
  "execution_class": "LOCAL_MUTATING",
  "status": "ACTIVATION_GATED",
  "controller_plugin": "ecc-controller",
  "skill_paths": [
    "plugins/ecc-controller/skills/ecc-controller/SKILL.md"
  ],
  "mcp_servers": [],
  "runtime_probe": null,
  "upstream": {
    "repository": "https://github.com/affaan-m/ECC.git",
    "ref": "main",
    "commit": "ef648e01899ba3e8dc6371642deaaf64b4477775",
    "license_status": "MIT",
    "relationship": "official_upstream_plugin_reference"
  }
}
