{
  "schema_version": 1,
  "id": "wf-jakeschincariol-arena-skill-c734ca29",
  "display_name": "Jakeschincariol/arena-skill Workflow",
  "source_type": "local",
  "source": "plugins/repository-workflows/individual/wf-jakeschincariol-arena-skill-c734ca29",
  "license_status": "MIT",
  "execution_class": "LOCAL_MUTATING",
  "status": "PACKAGED",
  "controller_plugin": "wf-jakeschincariol-arena-skill-c734ca29",
  "skill_paths": [
    "plugins/repository-workflows/individual/wf-jakeschincariol-arena-skill-c734ca29/skills/wf-jakeschincariol-arena-skill-c734ca29/SKILL.md"
  ],
  "mcp_servers": [],
  "runtime_probe": null
}