{
  "schema_version": 1,
  "id": "subagent-broker",
  "display_name": "WhiteChronos Subagent Broker",
  "source_type": "local",
  "source": "plugins/subagent-broker",
  "license_status": "MIT",
  "execution_class": "LOCAL_MUTATING",
  "status": "REGISTERED_PROJECT",
  "controller_plugin": "subagent-broker",
  "skill_paths": ["plugins/subagent-broker/skills/subagent-broker/SKILL.md"],
  "mcp_servers": ["subagent_broker"],
  "upstream": {
    "repository": "https://github.com/Shubhamsaboo/awesome-llm-apps.git",
    "ref": "main",
    "commit": "4bf51ab704fb2c5b3803cd5191b30d7dcdb51dc2",
    "license_status": "Apache-2.0",
    "relationship": "agent_ecosystem_reference"
  },
  "runtime_probe": {
    "plugin_root": "plugins/subagent-broker",
    "mcp_config": ".mcp.json",
    "mcp_server": "subagent_broker",
    "expected_tools": ["subagent_spawn", "subagent_status", "subagent_wait", "subagent_result", "subagent_followup", "subagent_list", "subagent_cancel", "subagent_cleanup"],
    "required_for_broker_smoke": true
  }
}
