{
  "schema_version": 1,
  "id": "wf-kepano-obsidian-skills-bdf89258",
  "display_name": "kepano/obsidian-skills Workflow",
  "source_type": "local",
  "source": "plugins/repository-workflows/individual/wf-kepano-obsidian-skills-bdf89258",
  "license_status": "MIT",
  "execution_class": "LOCAL_MUTATING",
  "status": "PACKAGED",
  "controller_plugin": "wf-kepano-obsidian-skills-bdf89258",
  "skill_paths": [
    "plugins/repository-workflows/individual/wf-kepano-obsidian-skills-bdf89258/skills/wf-kepano-obsidian-skills-bdf89258/SKILL.md"
  ],
  "mcp_servers": [],
  "runtime_probe": null
}