{
  "schema_version": 1,
  "id": "wf-jamesmoore24-treegpt-6a43b665",
  "display_name": "jamesmoore24/treegpt Workflow",
  "source_type": "local",
  "source": "plugins/repository-workflows/individual/wf-jamesmoore24-treegpt-6a43b665",
  "license_status": "MIT",
  "execution_class": "LOCAL_MUTATING",
  "status": "PACKAGED",
  "controller_plugin": "wf-jamesmoore24-treegpt-6a43b665",
  "skill_paths": [
    "plugins/repository-workflows/individual/wf-jamesmoore24-treegpt-6a43b665/skills/wf-jamesmoore24-treegpt-6a43b665/SKILL.md"
  ],
  "mcp_servers": [],
  "runtime_probe": null
}