{
  "schema_version": 1,
  "id": "wf-lognebudo-llmxray-26c34ef4",
  "display_name": "LogneBudo/llmxray Workflow",
  "source_type": "local",
  "source": "plugins/repository-workflows/individual/wf-lognebudo-llmxray-26c34ef4",
  "license_status": "MIT",
  "execution_class": "LOCAL_MUTATING",
  "status": "PACKAGED",
  "controller_plugin": "wf-lognebudo-llmxray-26c34ef4",
  "skill_paths": [
    "plugins/repository-workflows/individual/wf-lognebudo-llmxray-26c34ef4/skills/wf-lognebudo-llmxray-26c34ef4/SKILL.md"
  ],
  "mcp_servers": [],
  "runtime_probe": null
}