{
  "schema_version": 1,
  "id": "wf-github-spec-kit-ea503c1a",
  "display_name": "github/spec-kit Workflow",
  "source_type": "local",
  "source": "plugins/repository-workflows/individual/wf-github-spec-kit-ea503c1a",
  "license_status": "MIT",
  "execution_class": "LOCAL_MUTATING",
  "status": "PACKAGED",
  "controller_plugin": "wf-github-spec-kit-ea503c1a",
  "skill_paths": [
    "plugins/repository-workflows/individual/wf-github-spec-kit-ea503c1a/skills/wf-github-spec-kit-ea503c1a/SKILL.md"
  ],
  "mcp_servers": [],
  "runtime_probe": null
}